{
  "$schema": "https://json-schema.org/draft/2020-12/schema",
  "$id": "https://juicemount.contract/v1/spool-status.schema.json",
  "title": "SpoolStatusResponse",
  "description": "GET /spool write-spool state, including pending file and offline-symlink work. HTTP 503 with enabled=false when the spool is not enabled. entries is capped at 200 active rows plus a short done tail. Served by the GUI and jm5 CLI.",
  "type": "object",
  "additionalProperties": false,
  "required": ["enabled", "pending_files", "pending_symlinks", "pending_bytes", "in_progress", "succeeded", "failed", "quarantined", "sidecars_skipped", "capacity_used", "capacity_total", "stalled_files", "failed_files", "declined_files", "oldest_pending_age_sec", "suspect_zero_tail", "stall_waiters", "offline", "offline_buffer_full", "entries"],
  "properties": {
    "enabled": { "type": "boolean" },
    "recovery_enabled": { "type": "boolean", "description": "Effective local replacement dispatcher configuration when known; does not assert provider capability." },
    "error": { "type": "string", "description": "Present when disabled or on SQL error." },
    "pending_files": { "type": "integer", "minimum": 0 },
    "pending_symlinks": { "type": "integer", "minimum": 0 },
    "pending_bytes": { "type": "integer", "minimum": 0 },
    "in_progress": { "type": "integer", "minimum": 0 },
    "succeeded": { "type": "integer", "minimum": 0 },
    "failed": { "type": "integer", "minimum": 0 },
    "quarantined": { "type": "integer", "minimum": 0 },
    "sidecars_skipped": { "type": "integer", "minimum": 0 },
    "capacity_used": { "type": "integer", "minimum": 0 },
    "capacity_total": { "type": "integer", "minimum": 0 },
    "stalled_files": { "type": "integer", "minimum": 0 },
    "failed_files": { "type": "integer", "minimum": 0, "description": "Distinct from top-level 'failed' (a counter); this is the current count of files in the failed drain_state." },
    "declined_files": { "type": "integer", "minimum": 0 },
    "replacement_conflicts": { "type": "integer", "minimum": 0, "description": "Accepted atomic saves held locally after another writer intervened; not failed uploads." },
    "replacement_waiting": { "type": "integer", "minimum": 0, "description": "Accepted atomic saves awaiting writer authority re-evaluation." },
    "oldest_pending_age_sec": { "type": "integer", "minimum": 0 },
    "suspect_zero_tail": { "type": "integer", "minimum": 0 },
    "stall_waiters": { "type": "integer", "minimum": 0 },
    "offline": { "type": "boolean", "description": "Spool is holding because the volume is offline." },
    "offline_buffer_full": { "type": "boolean" },
    "entries": {
      "type": "array",
      "items": {
        "type": "object",
        "additionalProperties": false,
        "required": ["path", "size", "drain_state", "drain_attempts", "updated_at_unix", "age_sec", "stalled"],
        "properties": {
          "path": { "type": "string", "description": "Absolute nfs_path of the spooled file." },
          "size": { "type": "integer", "minimum": 0 },
          "drain_state": { "enum": ["writing", "ready", "draining", "done", "failed"], "description": "Active rows are newest-first; a short recently-done tail may appear." },
          "drain_attempts": { "type": "integer", "minimum": 0 },
          "last_error": { "type": "string" },
          "replacement_state": { "enum": ["waiting_writer", "writer_changed", "recovery_disabled", "offline", "queued", "provider_unavailable", "finishing"], "description": "Local accepted-save availability or validated writer disposition; does not authorize retry, discard, or overwrite." },
          "updated_at_unix": { "type": "integer" },
          "age_sec": { "type": "integer", "minimum": 0 },
          "stalled": { "type": "boolean" },
          "suspect_zero_tail": { "type": "boolean" },
          "suspect_zero_tail_detail": { "type": "string" }
        }
      }
    }
  }
}
